{
  "required" : true ,
  "$schema" : "http://json-schema.org/draft-03/schema" ,
  "type" : "object" ,
  "properties" : {
    "ano" : {
      "type" : "array" ,
      "required" : false ,
      "items" : [
        {
          "type" : "string"
        }
      ]
    } ,
    "mes" : {
      "type" : "string" ,
      "required" : false
    } ,
    "dadosagregados" : {
      "type" : "string" ,
      "required" : false
    } ,
    "municipio" : {
      "type" : "string" ,
      "required" : false
    } ,
    "tipoagregacao" : {
      "type" : "string" ,
      "required" : false
    } ,
    "estado" : {
      "type" : "string" ,
      "required" : false
    }
  }
}