{
  "ano" : [
    "some value" ,
    "some value" ,
    "some value" ,
    "some value" ,
    "some value" ,
    "some value" ,
    "some value"
  ] ,
  "mes" : "some value" ,
  "dadosagregados" : "some value" ,
  "municipio" : "some value" ,
  "tipoagregacao" : "some value" ,
  "estado" : "some value"
}